gt_path	lq_path	caption	degradation
/data2/users/zhangxu/ISP/1_AIR/PhyDAE/dataset/MD_RSID/train/clean/1.png	/data2/users/zhangxu/ISP/1_AIR/PhyDAE/dataset/MD_RSID/train/blur/1.png	an aerial view of the construction site	blur
/data2/users/zhangxu/ISP/1_AIR/PhyDAE/dataset/MD_RSID/train/clean/10.png	/data2/users/zhangxu/ISP/1_AIR/PhyDAE/dataset/MD_RSID/train/blur/10.png	the shadow of a person	blur
/data2/users/zhangxu/ISP/1_AIR/PhyDAE/dataset/MD_RSID/train/clean/100.png	/data2/users/zhangxu/ISP/1_AIR/PhyDAE/dataset/MD_RSID/train/blur/100.png	an aerial view of an airport in the snow	blur
/data2/users/zhangxu/ISP/1_AIR/PhyDAE/dataset/MD_RSID/train/clean/1000.png	/data2/users/zhangxu/ISP/1_AIR/PhyDAE/dataset/MD_RSID/train/blur/1000.png	an image of the sun from space	blur
/data2/users/zhangxu/ISP/1_AIR/PhyDAE/dataset/MD_RSID/train/clean/101.png	/data2/users/zhangxu/ISP/1_AIR/PhyDAE/dataset/MD_RSID/train/blur/101.png	an aerial view of a farm in the middle of the country	blur
/data2/users/zhangxu/ISP/1_AIR/PhyDAE/dataset/MD_RSID/train/clean/102.png	/data2/users/zhangxu/ISP/1_AIR/PhyDAE/dataset/MD_RSID/train/blur/102.png	a painting of clouds in the sky	blur
/data2/users/zhangxu/ISP/1_AIR/PhyDAE/dataset/MD_RSID/train/clean/104.png	/data2/users/zhangxu/ISP/1_AIR/PhyDAE/dataset/MD_RSID/train/blur/104.png	a large group of people standing in a field	blur
/data2/users/zhangxu/ISP/1_AIR/PhyDAE/dataset/MD_RSID/train/clean/105.png	/data2/users/zhangxu/ISP/1_AIR/PhyDAE/dataset/MD_RSID/train/blur/105.png	a blury image of a building in a city	blur
/data2/users/zhangxu/ISP/1_AIR/PhyDAE/dataset/MD_RSID/train/clean/106.png	/data2/users/zhangxu/ISP/1_AIR/PhyDAE/dataset/MD_RSID/train/blur/106.png	an aerial view of the site of the former military base	blur
/data2/users/zhangxu/ISP/1_AIR/PhyDAE/dataset/MD_RSID/train/clean/108.png	/data2/users/zhangxu/ISP/1_AIR/PhyDAE/dataset/MD_RSID/train/blur/108.png	an aerial view of a snow covered parking lot	blur
/data2/users/zhangxu/ISP/1_AIR/PhyDAE/dataset/MD_RSID/train/clean/109.png	/data2/users/zhangxu/ISP/1_AIR/PhyDAE/dataset/MD_RSID/train/blur/109.png	a blurry image of a street with a stop sign	blur
/data2/users/zhangxu/ISP/1_AIR/PhyDAE/dataset/MD_RSID/train/clean/11.png	/data2/users/zhangxu/ISP/1_AIR/PhyDAE/dataset/MD_RSID/train/blur/11.png	a piece of paper sitting on top of a table	blur
/data2/users/zhangxu/ISP/1_AIR/PhyDAE/dataset/MD_RSID/train/clean/110.png	/data2/users/zhangxu/ISP/1_AIR/PhyDAE/dataset/MD_RSID/train/blur/110.png	an aerial view of a city from the air	blur
/data2/users/zhangxu/ISP/1_AIR/PhyDAE/dataset/MD_RSID/train/clean/112.png	/data2/users/zhangxu/ISP/1_AIR/PhyDAE/dataset/MD_RSID/train/blur/112.png	an image of snow on the ground	blur
/data2/users/zhangxu/ISP/1_AIR/PhyDAE/dataset/MD_RSID/train/clean/113.png	/data2/users/zhangxu/ISP/1_AIR/PhyDAE/dataset/MD_RSID/train/blur/113.png	an aerial view of a field with trees	blur
/data2/users/zhangxu/ISP/1_AIR/PhyDAE/dataset/MD_RSID/train/clean/114.png	/data2/users/zhangxu/ISP/1_AIR/PhyDAE/dataset/MD_RSID/train/blur/114.png	an aerial view of a snow covered area	blur
/data2/users/zhangxu/ISP/1_AIR/PhyDAE/dataset/MD_RSID/train/clean/115.png	/data2/users/zhangxu/ISP/1_AIR/PhyDAE/dataset/MD_RSID/train/blur/115.png	a piece of paper with black ink on it	blur
/data2/users/zhangxu/ISP/1_AIR/PhyDAE/dataset/MD_RSID/train/clean/117.png	/data2/users/zhangxu/ISP/1_AIR/PhyDAE/dataset/MD_RSID/train/blur/117.png	a black and white photo of a building	blur
/data2/users/zhangxu/ISP/1_AIR/PhyDAE/dataset/MD_RSID/train/clean/118.png	/data2/users/zhangxu/ISP/1_AIR/PhyDAE/dataset/MD_RSID/train/blur/118.png	an aerial view of a city with lots of buildings	blur
/data2/users/zhangxu/ISP/1_AIR/PhyDAE/dataset/MD_RSID/train/clean/119.png	/data2/users/zhangxu/ISP/1_AIR/PhyDAE/dataset/MD_RSID/train/blur/119.png	a blurry image of a tree in the woods	blur
/data2/users/zhangxu/ISP/1_AIR/PhyDAE/dataset/MD_RSID/train/clean/12.png	/data2/users/zhangxu/ISP/1_AIR/PhyDAE/dataset/MD_RSID/train/blur/12.png	an aerial view of a boat in the water	blur
/data2/users/zhangxu/ISP/1_AIR/PhyDAE/dataset/MD_RSID/train/clean/121.png	/data2/users/zhangxu/ISP/1_AIR/PhyDAE/dataset/MD_RSID/train/blur/121.png	an aerial view of a city with lots of buildings	blur
/data2/users/zhangxu/ISP/1_AIR/PhyDAE/dataset/MD_RSID/train/clean/123.png	/data2/users/zhangxu/ISP/1_AIR/PhyDAE/dataset/MD_RSID/train/blur/123.png	an aerial view of a city from the air	blur
/data2/users/zhangxu/ISP/1_AIR/PhyDAE/dataset/MD_RSID/train/clean/124.png	/data2/users/zhangxu/ISP/1_AIR/PhyDAE/dataset/MD_RSID/train/blur/124.png	an aerial view of a small town	blur
/data2/users/zhangxu/ISP/1_AIR/PhyDAE/dataset/MD_RSID/train/clean/126.png	/data2/users/zhangxu/ISP/1_AIR/PhyDAE/dataset/MD_RSID/train/blur/126.png	an aerial view of the ruins of the ancient city	blur
/data2/users/zhangxu/ISP/1_AIR/PhyDAE/dataset/MD_RSID/train/clean/128.png	/data2/users/zhangxu/ISP/1_AIR/PhyDAE/dataset/MD_RSID/train/blur/128.png	an aerial view of a green field with buildings in the background	blur
/data2/users/zhangxu/ISP/1_AIR/PhyDAE/dataset/MD_RSID/train/clean/129.png	/data2/users/zhangxu/ISP/1_AIR/PhyDAE/dataset/MD_RSID/train/blur/129.png	an aerial view of a train track in the woods	blur
/data2/users/zhangxu/ISP/1_AIR/PhyDAE/dataset/MD_RSID/train/clean/130.png	/data2/users/zhangxu/ISP/1_AIR/PhyDAE/dataset/MD_RSID/train/blur/130.png	an aerial view of a small town	blur
/data2/users/zhangxu/ISP/1_AIR/PhyDAE/dataset/MD_RSID/train/clean/131.png	/data2/users/zhangxu/ISP/1_AIR/PhyDAE/dataset/MD_RSID/train/blur/131.png	a blur image of a person riding a bike	blur
/data2/users/zhangxu/ISP/1_AIR/PhyDAE/dataset/MD_RSID/train/clean/132.png	/data2/users/zhangxu/ISP/1_AIR/PhyDAE/dataset/MD_RSID/train/blur/132.png	an aerial view of a school building	blur
/data2/users/zhangxu/ISP/1_AIR/PhyDAE/dataset/MD_RSID/train/clean/133.png	/data2/users/zhangxu/ISP/1_AIR/PhyDAE/dataset/MD_RSID/train/blur/133.png	a man riding a motorcycle down a hill	blur
/data2/users/zhangxu/ISP/1_AIR/PhyDAE/dataset/MD_RSID/train/clean/134.png	/data2/users/zhangxu/ISP/1_AIR/PhyDAE/dataset/MD_RSID/train/blur/134.png	an aerial view of a building in the snow	blur
/data2/users/zhangxu/ISP/1_AIR/PhyDAE/dataset/MD_RSID/train/clean/136.png	/data2/users/zhangxu/ISP/1_AIR/PhyDAE/dataset/MD_RSID/train/blur/136.png	an aerial view of a small town	blur
/data2/users/zhangxu/ISP/1_AIR/PhyDAE/dataset/MD_RSID/train/clean/137.png	/data2/users/zhangxu/ISP/1_AIR/PhyDAE/dataset/MD_RSID/train/blur/137.png	an aerial view of the runway at the airport	blur
/data2/users/zhangxu/ISP/1_AIR/PhyDAE/dataset/MD_RSID/train/clean/139.png	/data2/users/zhangxu/ISP/1_AIR/PhyDAE/dataset/MD_RSID/train/blur/139.png	an aerial view of a city with many buildings	blur
/data2/users/zhangxu/ISP/1_AIR/PhyDAE/dataset/MD_RSID/train/clean/140.png	/data2/users/zhangxu/ISP/1_AIR/PhyDAE/dataset/MD_RSID/train/blur/140.png	a blurry image of a person on a skateboard	blur
/data2/users/zhangxu/ISP/1_AIR/PhyDAE/dataset/MD_RSID/train/clean/141.png	/data2/users/zhangxu/ISP/1_AIR/PhyDAE/dataset/MD_RSID/train/blur/141.png	an aerial view of a large ship in the water	blur
/data2/users/zhangxu/ISP/1_AIR/PhyDAE/dataset/MD_RSID/train/clean/142.png	/data2/users/zhangxu/ISP/1_AIR/PhyDAE/dataset/MD_RSID/train/blur/142.png	an aerial view of a city with lots of buildings	blur
/data2/users/zhangxu/ISP/1_AIR/PhyDAE/dataset/MD_RSID/train/clean/143.png	/data2/users/zhangxu/ISP/1_AIR/PhyDAE/dataset/MD_RSID/train/blur/143.png	an image of the surface of mars	blur
/data2/users/zhangxu/ISP/1_AIR/PhyDAE/dataset/MD_RSID/train/clean/144.png	/data2/users/zhangxu/ISP/1_AIR/PhyDAE/dataset/MD_RSID/train/blur/144.png	a close up view of rocks and water	blur
/data2/users/zhangxu/ISP/1_AIR/PhyDAE/dataset/MD_RSID/train/clean/145.png	/data2/users/zhangxu/ISP/1_AIR/PhyDAE/dataset/MD_RSID/train/blur/145.png	a group of birds flying in the sky	blur
/data2/users/zhangxu/ISP/1_AIR/PhyDAE/dataset/MD_RSID/train/clean/146.png	/data2/users/zhangxu/ISP/1_AIR/PhyDAE/dataset/MD_RSID/train/blur/146.png	an aerial view of a field and a road	blur
/data2/users/zhangxu/ISP/1_AIR/PhyDAE/dataset/MD_RSID/train/clean/147.png	/data2/users/zhangxu/ISP/1_AIR/PhyDAE/dataset/MD_RSID/train/blur/147.png	the plane is flying in the air	blur
/data2/users/zhangxu/ISP/1_AIR/PhyDAE/dataset/MD_RSID/train/clean/148.png	/data2/users/zhangxu/ISP/1_AIR/PhyDAE/dataset/MD_RSID/train/blur/148.png	an aerial view of a city from a plane	blur
/data2/users/zhangxu/ISP/1_AIR/PhyDAE/dataset/MD_RSID/train/clean/149.png	/data2/users/zhangxu/ISP/1_AIR/PhyDAE/dataset/MD_RSID/train/blur/149.png	an aerial view of a large building in the desert	blur
/data2/users/zhangxu/ISP/1_AIR/PhyDAE/dataset/MD_RSID/train/clean/15.png	/data2/users/zhangxu/ISP/1_AIR/PhyDAE/dataset/MD_RSID/train/blur/15.png	live camera from a distance of a mountain	blur
/data2/users/zhangxu/ISP/1_AIR/PhyDAE/dataset/MD_RSID/train/clean/151.png	/data2/users/zhangxu/ISP/1_AIR/PhyDAE/dataset/MD_RSID/train/blur/151.png	an aerial view of a small town in the countryside	blur
/data2/users/zhangxu/ISP/1_AIR/PhyDAE/dataset/MD_RSID/train/clean/152.png	/data2/users/zhangxu/ISP/1_AIR/PhyDAE/dataset/MD_RSID/train/blur/152.png	an aerial view of a city from the air	blur
/data2/users/zhangxu/ISP/1_AIR/PhyDAE/dataset/MD_RSID/train/clean/153.png	/data2/users/zhangxu/ISP/1_AIR/PhyDAE/dataset/MD_RSID/train/blur/153.png	an aerial view of a city with buildings	blur
/data2/users/zhangxu/ISP/1_AIR/PhyDAE/dataset/MD_RSID/train/clean/154.png	/data2/users/zhangxu/ISP/1_AIR/PhyDAE/dataset/MD_RSID/train/blur/154.png	an aerial view of a desert area	blur
/data2/users/zhangxu/ISP/1_AIR/PhyDAE/dataset/MD_RSID/train/clean/155.png	/data2/users/zhangxu/ISP/1_AIR/PhyDAE/dataset/MD_RSID/train/blur/155.png	an aerial view of a snow covered road	blur
/data2/users/zhangxu/ISP/1_AIR/PhyDAE/dataset/MD_RSID/train/clean/156.png	/data2/users/zhangxu/ISP/1_AIR/PhyDAE/dataset/MD_RSID/train/blur/156.png	a painting of a man in a suit and tie	blur
/data2/users/zhangxu/ISP/1_AIR/PhyDAE/dataset/MD_RSID/train/clean/157.png	/data2/users/zhangxu/ISP/1_AIR/PhyDAE/dataset/MD_RSID/train/blur/157.png	a black and white photo of a tree in the snow	blur
/data2/users/zhangxu/ISP/1_AIR/PhyDAE/dataset/MD_RSID/train/clean/158.png	/data2/users/zhangxu/ISP/1_AIR/PhyDAE/dataset/MD_RSID/train/blur/158.png	a blurry image of a building in the city	blur
/data2/users/zhangxu/ISP/1_AIR/PhyDAE/dataset/MD_RSID/train/clean/159.png	/data2/users/zhangxu/ISP/1_AIR/PhyDAE/dataset/MD_RSID/train/blur/159.png	an aerial view of a city from a plane	blur
/data2/users/zhangxu/ISP/1_AIR/PhyDAE/dataset/MD_RSID/train/clean/16.png	/data2/users/zhangxu/ISP/1_AIR/PhyDAE/dataset/MD_RSID/train/blur/16.png	an aerial view of a plane flying over a field	blur
/data2/users/zhangxu/ISP/1_AIR/PhyDAE/dataset/MD_RSID/train/clean/160.png	/data2/users/zhangxu/ISP/1_AIR/PhyDAE/dataset/MD_RSID/train/blur/160.png	an aerial view of the site of the site	blur
/data2/users/zhangxu/ISP/1_AIR/PhyDAE/dataset/MD_RSID/train/clean/161.png	/data2/users/zhangxu/ISP/1_AIR/PhyDAE/dataset/MD_RSID/train/blur/161.png	an aerial view of a dirt field	blur
/data2/users/zhangxu/ISP/1_AIR/PhyDAE/dataset/MD_RSID/train/clean/163.png	/data2/users/zhangxu/ISP/1_AIR/PhyDAE/dataset/MD_RSID/train/blur/163.png	an aerial view of a city with buildings	blur
/data2/users/zhangxu/ISP/1_AIR/PhyDAE/dataset/MD_RSID/train/clean/164.png	/data2/users/zhangxu/ISP/1_AIR/PhyDAE/dataset/MD_RSID/train/blur/164.png	an aerial view of an airport with several planes	blur
/data2/users/zhangxu/ISP/1_AIR/PhyDAE/dataset/MD_RSID/train/clean/166.png	/data2/users/zhangxu/ISP/1_AIR/PhyDAE/dataset/MD_RSID/train/blur/166.png	a map of the ancient city of babylon	blur
/data2/users/zhangxu/ISP/1_AIR/PhyDAE/dataset/MD_RSID/train/clean/167.png	/data2/users/zhangxu/ISP/1_AIR/PhyDAE/dataset/MD_RSID/train/blur/167.png	an aerial view of a field with a bird on it	blur
/data2/users/zhangxu/ISP/1_AIR/PhyDAE/dataset/MD_RSID/train/clean/168.png	/data2/users/zhangxu/ISP/1_AIR/PhyDAE/dataset/MD_RSID/train/blur/168.png	a black and white dog is standing in the grass	blur
/data2/users/zhangxu/ISP/1_AIR/PhyDAE/dataset/MD_RSID/train/clean/169.png	/data2/users/zhangxu/ISP/1_AIR/PhyDAE/dataset/MD_RSID/train/blur/169.png	an aerial view of a city from the air	blur
/data2/users/zhangxu/ISP/1_AIR/PhyDAE/dataset/MD_RSID/train/clean/17.png	/data2/users/zhangxu/ISP/1_AIR/PhyDAE/dataset/MD_RSID/train/blur/17.png	an aerial photo of a plane flying over a body of water	blur
/data2/users/zhangxu/ISP/1_AIR/PhyDAE/dataset/MD_RSID/train/clean/172.png	/data2/users/zhangxu/ISP/1_AIR/PhyDAE/dataset/MD_RSID/train/blur/172.png	an aerial view of the site of a nuclear plant	blur
/data2/users/zhangxu/ISP/1_AIR/PhyDAE/dataset/MD_RSID/train/clean/173.png	/data2/users/zhangxu/ISP/1_AIR/PhyDAE/dataset/MD_RSID/train/blur/173.png	an aerial view of a large airport	blur
/data2/users/zhangxu/ISP/1_AIR/PhyDAE/dataset/MD_RSID/train/clean/174.png	/data2/users/zhangxu/ISP/1_AIR/PhyDAE/dataset/MD_RSID/train/blur/174.png	a black and white photo of a city	blur
/data2/users/zhangxu/ISP/1_AIR/PhyDAE/dataset/MD_RSID/train/clean/176.png	/data2/users/zhangxu/ISP/1_AIR/PhyDAE/dataset/MD_RSID/train/blur/176.png	an aerial view of a large brick building	blur
/data2/users/zhangxu/ISP/1_AIR/PhyDAE/dataset/MD_RSID/train/clean/177.png	/data2/users/zhangxu/ISP/1_AIR/PhyDAE/dataset/MD_RSID/train/blur/177.png	a large flock of birds flying in the air	blur
/data2/users/zhangxu/ISP/1_AIR/PhyDAE/dataset/MD_RSID/train/clean/178.png	/data2/users/zhangxu/ISP/1_AIR/PhyDAE/dataset/MD_RSID/train/blur/178.png	an aerial view of a city with lots of buildings	blur
/data2/users/zhangxu/ISP/1_AIR/PhyDAE/dataset/MD_RSID/train/clean/180.png	/data2/users/zhangxu/ISP/1_AIR/PhyDAE/dataset/MD_RSID/train/blur/180.png	an aerial view of a parking lot	blur
/data2/users/zhangxu/ISP/1_AIR/PhyDAE/dataset/MD_RSID/train/clean/181.png	/data2/users/zhangxu/ISP/1_AIR/PhyDAE/dataset/MD_RSID/train/blur/181.png	a bird flying in the air over a field	blur
/data2/users/zhangxu/ISP/1_AIR/PhyDAE/dataset/MD_RSID/train/clean/182.png	/data2/users/zhangxu/ISP/1_AIR/PhyDAE/dataset/MD_RSID/train/blur/182.png	an aerial view of a road and a forest	blur
/data2/users/zhangxu/ISP/1_AIR/PhyDAE/dataset/MD_RSID/train/clean/185.png	/data2/users/zhangxu/ISP/1_AIR/PhyDAE/dataset/MD_RSID/train/blur/185.png	a large group of cars parked in a lot	blur
/data2/users/zhangxu/ISP/1_AIR/PhyDAE/dataset/MD_RSID/train/clean/186.png	/data2/users/zhangxu/ISP/1_AIR/PhyDAE/dataset/MD_RSID/train/blur/186.png	an aerial view of a small town in the philippines	blur
/data2/users/zhangxu/ISP/1_AIR/PhyDAE/dataset/MD_RSID/train/clean/187.png	/data2/users/zhangxu/ISP/1_AIR/PhyDAE/dataset/MD_RSID/train/blur/187.png	a satellite image of a river running through a valley	blur
/data2/users/zhangxu/ISP/1_AIR/PhyDAE/dataset/MD_RSID/train/clean/189.png	/data2/users/zhangxu/ISP/1_AIR/PhyDAE/dataset/MD_RSID/train/blur/189.png	a painting of a man in a suit and tie	blur
/data2/users/zhangxu/ISP/1_AIR/PhyDAE/dataset/MD_RSID/train/clean/19.png	/data2/users/zhangxu/ISP/1_AIR/PhyDAE/dataset/MD_RSID/train/blur/19.png	an aerial view of a city from above	blur
/data2/users/zhangxu/ISP/1_AIR/PhyDAE/dataset/MD_RSID/train/clean/190.png	/data2/users/zhangxu/ISP/1_AIR/PhyDAE/dataset/MD_RSID/train/blur/190.png	an aerial view of a city from the air	blur
/data2/users/zhangxu/ISP/1_AIR/PhyDAE/dataset/MD_RSID/train/clean/193.png	/data2/users/zhangxu/ISP/1_AIR/PhyDAE/dataset/MD_RSID/train/blur/193.png	an aerial photo of a dirt field	blur
/data2/users/zhangxu/ISP/1_AIR/PhyDAE/dataset/MD_RSID/train/clean/195.png	/data2/users/zhangxu/ISP/1_AIR/PhyDAE/dataset/MD_RSID/train/blur/195.png	an aerial photo of a farm	blur
/data2/users/zhangxu/ISP/1_AIR/PhyDAE/dataset/MD_RSID/train/clean/196.png	/data2/users/zhangxu/ISP/1_AIR/PhyDAE/dataset/MD_RSID/train/blur/196.png	an aerial view of a beach and a body of water	blur
/data2/users/zhangxu/ISP/1_AIR/PhyDAE/dataset/MD_RSID/train/clean/197.png	/data2/users/zhangxu/ISP/1_AIR/PhyDAE/dataset/MD_RSID/train/blur/197.png	an aerial view of a dirt road in the woods	blur
/data2/users/zhangxu/ISP/1_AIR/PhyDAE/dataset/MD_RSID/train/clean/198.png	/data2/users/zhangxu/ISP/1_AIR/PhyDAE/dataset/MD_RSID/train/blur/198.png	an aerial view of a city from a plane	blur
/data2/users/zhangxu/ISP/1_AIR/PhyDAE/dataset/MD_RSID/train/clean/199.png	/data2/users/zhangxu/ISP/1_AIR/PhyDAE/dataset/MD_RSID/train/blur/199.png	a close up of a tire on the ground	blur
/data2/users/zhangxu/ISP/1_AIR/PhyDAE/dataset/MD_RSID/train/clean/2.png	/data2/users/zhangxu/ISP/1_AIR/PhyDAE/dataset/MD_RSID/train/blur/2.png	an aerial view of a city with buildings	blur
/data2/users/zhangxu/ISP/1_AIR/PhyDAE/dataset/MD_RSID/train/clean/20.png	/data2/users/zhangxu/ISP/1_AIR/PhyDAE/dataset/MD_RSID/train/blur/20.png	an aerial view of a plane flying over a field	blur
/data2/users/zhangxu/ISP/1_AIR/PhyDAE/dataset/MD_RSID/train/clean/201.png	/data2/users/zhangxu/ISP/1_AIR/PhyDAE/dataset/MD_RSID/train/blur/201.png	an aerial view of a city from the air	blur
/data2/users/zhangxu/ISP/1_AIR/PhyDAE/dataset/MD_RSID/train/clean/203.png	/data2/users/zhangxu/ISP/1_AIR/PhyDAE/dataset/MD_RSID/train/blur/203.png	an aerial view of a mountain range	blur
/data2/users/zhangxu/ISP/1_AIR/PhyDAE/dataset/MD_RSID/train/clean/204.png	/data2/users/zhangxu/ISP/1_AIR/PhyDAE/dataset/MD_RSID/train/blur/204.png	an aerial view of a city from a plane	blur
/data2/users/zhangxu/ISP/1_AIR/PhyDAE/dataset/MD_RSID/train/clean/205.png	/data2/users/zhangxu/ISP/1_AIR/PhyDAE/dataset/MD_RSID/train/blur/205.png	an aerial view of a residential area	blur
/data2/users/zhangxu/ISP/1_AIR/PhyDAE/dataset/MD_RSID/train/clean/206.png	/data2/users/zhangxu/ISP/1_AIR/PhyDAE/dataset/MD_RSID/train/blur/206.png	a blurry image of an elephant in the wild	blur
/data2/users/zhangxu/ISP/1_AIR/PhyDAE/dataset/MD_RSID/train/clean/207.png	/data2/users/zhangxu/ISP/1_AIR/PhyDAE/dataset/MD_RSID/train/blur/207.png	an aerial view of a parking lot	blur
/data2/users/zhangxu/ISP/1_AIR/PhyDAE/dataset/MD_RSID/train/clean/208.png	/data2/users/zhangxu/ISP/1_AIR/PhyDAE/dataset/MD_RSID/train/blur/208.png	an aerial view of a parking lot	blur
/data2/users/zhangxu/ISP/1_AIR/PhyDAE/dataset/MD_RSID/train/clean/209.png	/data2/users/zhangxu/ISP/1_AIR/PhyDAE/dataset/MD_RSID/train/blur/209.png	a blurry image of a building in the city	blur
/data2/users/zhangxu/ISP/1_AIR/PhyDAE/dataset/MD_RSID/train/clean/21.png	/data2/users/zhangxu/ISP/1_AIR/PhyDAE/dataset/MD_RSID/train/blur/21.png	a group of people standing on top of a field	blur
/data2/users/zhangxu/ISP/1_AIR/PhyDAE/dataset/MD_RSID/train/clean/210.png	/data2/users/zhangxu/ISP/1_AIR/PhyDAE/dataset/MD_RSID/train/blur/210.png	a close up of a tree with snow on it	blur
/data2/users/zhangxu/ISP/1_AIR/PhyDAE/dataset/MD_RSID/train/clean/211.png	/data2/users/zhangxu/ISP/1_AIR/PhyDAE/dataset/MD_RSID/train/blur/211.png	an aerial view of a desert area	blur
/data2/users/zhangxu/ISP/1_AIR/PhyDAE/dataset/MD_RSID/train/clean/214.png	/data2/users/zhangxu/ISP/1_AIR/PhyDAE/dataset/MD_RSID/train/blur/214.png	an aerial view of a green field	blur
/data2/users/zhangxu/ISP/1_AIR/PhyDAE/dataset/MD_RSID/train/clean/215.png	/data2/users/zhangxu/ISP/1_AIR/PhyDAE/dataset/MD_RSID/train/blur/215.png	this is an aerial photo	blur
/data2/users/zhangxu/ISP/1_AIR/PhyDAE/dataset/MD_RSID/train/clean/216.png	/data2/users/zhangxu/ISP/1_AIR/PhyDAE/dataset/MD_RSID/train/blur/216.png	an aerial view of a baseball field	blur
/data2/users/zhangxu/ISP/1_AIR/PhyDAE/dataset/MD_RSID/train/clean/217.png	/data2/users/zhangxu/ISP/1_AIR/PhyDAE/dataset/MD_RSID/train/blur/217.png	an aerial photo of a house in the middle of a neighborhood	blur
/data2/users/zhangxu/ISP/1_AIR/PhyDAE/dataset/MD_RSID/train/clean/218.png	/data2/users/zhangxu/ISP/1_AIR/PhyDAE/dataset/MD_RSID/train/blur/218.png	a group of birds sitting on top of snow covered ground	blur
/data2/users/zhangxu/ISP/1_AIR/PhyDAE/dataset/MD_RSID/train/clean/219.png	/data2/users/zhangxu/ISP/1_AIR/PhyDAE/dataset/MD_RSID/train/blur/219.png	a man riding a snowboard down a hill	blur
/data2/users/zhangxu/ISP/1_AIR/PhyDAE/dataset/MD_RSID/train/clean/22.png	/data2/users/zhangxu/ISP/1_AIR/PhyDAE/dataset/MD_RSID/train/blur/22.png	a large body of water	blur
/data2/users/zhangxu/ISP/1_AIR/PhyDAE/dataset/MD_RSID/train/clean/221.png	/data2/users/zhangxu/ISP/1_AIR/PhyDAE/dataset/MD_RSID/train/blur/221.png	an aerial view of a green field and a road	blur
/data2/users/zhangxu/ISP/1_AIR/PhyDAE/dataset/MD_RSID/train/clean/223.png	/data2/users/zhangxu/ISP/1_AIR/PhyDAE/dataset/MD_RSID/train/blur/223.png	an aerial view of a baseball field	blur
/data2/users/zhangxu/ISP/1_AIR/PhyDAE/dataset/MD_RSID/train/clean/224.png	/data2/users/zhangxu/ISP/1_AIR/PhyDAE/dataset/MD_RSID/train/blur/224.png	an aerial view of a construction site	blur
/data2/users/zhangxu/ISP/1_AIR/PhyDAE/dataset/MD_RSID/train/clean/225.png	/data2/users/zhangxu/ISP/1_AIR/PhyDAE/dataset/MD_RSID/train/blur/225.png	an aerial view of a plane flying over the desert	blur
/data2/users/zhangxu/ISP/1_AIR/PhyDAE/dataset/MD_RSID/train/clean/227.png	/data2/users/zhangxu/ISP/1_AIR/PhyDAE/dataset/MD_RSID/train/blur/227.png	a black and white image of a field	blur
/data2/users/zhangxu/ISP/1_AIR/PhyDAE/dataset/MD_RSID/train/clean/229.png	/data2/users/zhangxu/ISP/1_AIR/PhyDAE/dataset/MD_RSID/train/blur/229.png	an aerial view of a city with lots of buildings	blur
/data2/users/zhangxu/ISP/1_AIR/PhyDAE/dataset/MD_RSID/train/clean/23.png	/data2/users/zhangxu/ISP/1_AIR/PhyDAE/dataset/MD_RSID/train/blur/23.png	an airplane is parked on the grass in a field	blur
/data2/users/zhangxu/ISP/1_AIR/PhyDAE/dataset/MD_RSID/train/clean/230.png	/data2/users/zhangxu/ISP/1_AIR/PhyDAE/dataset/MD_RSID/train/blur/230.png	an aerial view of a mountain range	blur
/data2/users/zhangxu/ISP/1_AIR/PhyDAE/dataset/MD_RSID/train/clean/231.png	/data2/users/zhangxu/ISP/1_AIR/PhyDAE/dataset/MD_RSID/train/blur/231.png	the mountains are covered in snow and ice	blur
/data2/users/zhangxu/ISP/1_AIR/PhyDAE/dataset/MD_RSID/train/clean/232.png	/data2/users/zhangxu/ISP/1_AIR/PhyDAE/dataset/MD_RSID/train/blur/232.png	the eiff tower in paris, france	blur
/data2/users/zhangxu/ISP/1_AIR/PhyDAE/dataset/MD_RSID/train/clean/233.png	/data2/users/zhangxu/ISP/1_AIR/PhyDAE/dataset/MD_RSID/train/blur/233.png	an aerial view of a road in the desert	blur
/data2/users/zhangxu/ISP/1_AIR/PhyDAE/dataset/MD_RSID/train/clean/234.png	/data2/users/zhangxu/ISP/1_AIR/PhyDAE/dataset/MD_RSID/train/blur/234.png	an aerial view of a city from a plane	blur
/data2/users/zhangxu/ISP/1_AIR/PhyDAE/dataset/MD_RSID/train/clean/235.png	/data2/users/zhangxu/ISP/1_AIR/PhyDAE/dataset/MD_RSID/train/blur/235.png	this is an image of a snow covered area	blur
/data2/users/zhangxu/ISP/1_AIR/PhyDAE/dataset/MD_RSID/train/clean/236.png	/data2/users/zhangxu/ISP/1_AIR/PhyDAE/dataset/MD_RSID/train/blur/236.png	a close up view of the surface of a rock	blur
/data2/users/zhangxu/ISP/1_AIR/PhyDAE/dataset/MD_RSID/train/clean/237.png	/data2/users/zhangxu/ISP/1_AIR/PhyDAE/dataset/MD_RSID/train/blur/237.png	a blurry image of a tree in the sky	blur
/data2/users/zhangxu/ISP/1_AIR/PhyDAE/dataset/MD_RSID/train/clean/238.png	/data2/users/zhangxu/ISP/1_AIR/PhyDAE/dataset/MD_RSID/train/blur/238.png	an aerial view of the site of a military base	blur
/data2/users/zhangxu/ISP/1_AIR/PhyDAE/dataset/MD_RSID/train/clean/239.png	/data2/users/zhangxu/ISP/1_AIR/PhyDAE/dataset/MD_RSID/train/blur/239.png	an aerial view of a city with many buildings	blur
/data2/users/zhangxu/ISP/1_AIR/PhyDAE/dataset/MD_RSID/train/clean/24.png	/data2/users/zhangxu/ISP/1_AIR/PhyDAE/dataset/MD_RSID/train/blur/24.png	an image of a bunch of flowers on the ground	blur
/data2/users/zhangxu/ISP/1_AIR/PhyDAE/dataset/MD_RSID/train/clean/240.png	/data2/users/zhangxu/ISP/1_AIR/PhyDAE/dataset/MD_RSID/train/blur/240.png	an aerial view of a city with buildings	blur
/data2/users/zhangxu/ISP/1_AIR/PhyDAE/dataset/MD_RSID/train/clean/242.png	/data2/users/zhangxu/ISP/1_AIR/PhyDAE/dataset/MD_RSID/train/blur/242.png	an image of a building in the middle of a city	blur
/data2/users/zhangxu/ISP/1_AIR/PhyDAE/dataset/MD_RSID/train/clean/243.png	/data2/users/zhangxu/ISP/1_AIR/PhyDAE/dataset/MD_RSID/train/blur/243.png	an aerial view of a city with lots of buildings	blur
/data2/users/zhangxu/ISP/1_AIR/PhyDAE/dataset/MD_RSID/train/clean/244.png	/data2/users/zhangxu/ISP/1_AIR/PhyDAE/dataset/MD_RSID/train/blur/244.png	an aerial view of a desert with a building in the background	blur
/data2/users/zhangxu/ISP/1_AIR/PhyDAE/dataset/MD_RSID/train/clean/246.png	/data2/users/zhangxu/ISP/1_AIR/PhyDAE/dataset/MD_RSID/train/blur/246.png	a satellite image of a mountain with a small patch in the middle	blur
/data2/users/zhangxu/ISP/1_AIR/PhyDAE/dataset/MD_RSID/train/clean/249.png	/data2/users/zhangxu/ISP/1_AIR/PhyDAE/dataset/MD_RSID/train/blur/249.png	a map of a city with lots of buildings	blur
/data2/users/zhangxu/ISP/1_AIR/PhyDAE/dataset/MD_RSID/train/clean/25.png	/data2/users/zhangxu/ISP/1_AIR/PhyDAE/dataset/MD_RSID/train/blur/25.png	an aerial view of a house in a residential area	blur
/data2/users/zhangxu/ISP/1_AIR/PhyDAE/dataset/MD_RSID/train/clean/250.png	/data2/users/zhangxu/ISP/1_AIR/PhyDAE/dataset/MD_RSID/train/blur/250.png	an aerial view of a road with cars parked on it	blur
/data2/users/zhangxu/ISP/1_AIR/PhyDAE/dataset/MD_RSID/train/clean/252.png	/data2/users/zhangxu/ISP/1_AIR/PhyDAE/dataset/MD_RSID/train/blur/252.png	an aerial view of the mississippi river	blur
/data2/users/zhangxu/ISP/1_AIR/PhyDAE/dataset/MD_RSID/train/clean/253.png	/data2/users/zhangxu/ISP/1_AIR/PhyDAE/dataset/MD_RSID/train/blur/253.png	an aerial view of a city from above	blur
/data2/users/zhangxu/ISP/1_AIR/PhyDAE/dataset/MD_RSID/train/clean/254.png	/data2/users/zhangxu/ISP/1_AIR/PhyDAE/dataset/MD_RSID/train/blur/254.png	an aerial view of a city from the air	blur
